{
  "contract": "168h_human_snapshot@1.0.0",
  "source_sha256": "de83a11f763d8b86e38c0020593ce4ae03b8e294323b80967ece1d104fb36f7a",
  "units": "METRIC",
  "scale_length": 1.0,
  "root_matrix": [
    [
      1.0,
      0.0,
      0.0,
      0.0
    ],
    [
      0.0,
      1.0,
      0.0,
      0.0
    ],
    [
      0.0,
      0.0,
      1.0,
      0.0
    ],
    [
      0.0,
      0.0,
      0.0,
      1.0
    ]
  ],
  "armature_matrix": [
    [
      1.0,
      0.0,
      0.0,
      0.0
    ],
    [
      0.0,
      1.0,
      0.0,
      0.0
    ],
    [
      0.0,
      0.0,
      1.0,
      0.0
    ],
    [
      0.0,
      0.0,
      0.0,
      1.0
    ]
  ],
  "collection_offset_m": [
    0.0,
    0.0,
    0.0
  ],
  "body_min_z_m": -2.3424373551961253e-09,
  "body_height_m": 1.7500000023424374,
  "hierarchy_valid": true,
  "transforms_normalized": true,
  "skinning_valid": true,
  "bones": [
    {
      "name": "root",
      "parent": null,
      "deform": false,
      "connected": false,
      "head_m": [
        0.0,
        0.0,
        0.0
      ],
      "tail_m": [
        0.0,
        0.0,
        0.10000000149011612
      ],
      "z_axis": [
        -1.5099580252808664e-07,
        1.0,
        0.0
      ],
      "pose_identity": true
    },
    {
      "name": "pelvis",
      "parent": "root",
      "deform": true,
      "connected": false,
      "head_m": [
        0.0,
        0.0,
        0.9399999976158142
      ],
      "tail_m": [
        0.0,
        0.0,
        1.034999966621399
      ],
      "z_axis": [
        -8.742277657347586e-08,
        1.0,
        0.0
      ],
      "pose_identity": true
    },
    {
      "name": "spine_01",
      "parent": "pelvis",
      "deform": true,
      "connected": true,
      "head_m": [
        0.0,
        0.0,
        1.034999966621399
      ],
      "tail_m": [
        0.0,
        0.0,
        1.1699999570846558
      ],
      "z_axis": [
        -8.742277657347586e-08,
        1.0,
        0.0
      ],
      "pose_identity": true
    },
    {
      "name": "spine_02",
      "parent": "spine_01",
      "deform": true,
      "connected": true,
      "head_m": [
        0.0,
        0.0,
        1.1699999570846558
      ],
      "tail_m": [
        0.0,
        0.0,
        1.309999942779541
      ],
      "z_axis": [
        -8.742277657347586e-08,
        1.0,
        0.0
      ],
      "pose_identity": true
    },
    {
      "name": "spine_03",
      "parent": "spine_02",
      "deform": true,
      "connected": true,
      "head_m": [
        0.0,
        0.0,
        1.309999942779541
      ],
      "tail_m": [
        0.0,
        0.0,
        1.4299999475479126
      ],
      "z_axis": [
        -8.742277657347586e-08,
        1.0,
        0.0
      ],
      "pose_identity": true
    },
    {
      "name": "neck",
      "parent": "spine_03",
      "deform": true,
      "connected": true,
      "head_m": [
        0.0,
        0.0,
        1.4299999475479126
      ],
      "tail_m": [
        0.0,
        0.0,
        1.534999966621399
      ],
      "z_axis": [
        -8.742277657347586e-08,
        1.0,
        0.0
      ],
      "pose_identity": true
    },
    {
      "name": "head",
      "parent": "neck",
      "deform": true,
      "connected": true,
      "head_m": [
        0.0,
        0.0,
        1.534999966621399
      ],
      "tail_m": [
        0.0,
        0.0,
        1.7000000476837158
      ],
      "z_axis": [
        -8.742277657347586e-08,
        1.0,
        0.0
      ],
      "pose_identity": true
    },
    {
      "name": "clavicle_l",
      "parent": "spine_03",
      "deform": true,
      "connected": false,
      "head_m": [
        0.0,
        0.0,
        1.4299999475479126
      ],
      "tail_m": [
        0.1850000023841858,
        0.0,
        1.4299999475479126
      ],
      "z_axis": [
        0.0,
        1.0,
        7.549790126404332e-08
      ],
      "pose_identity": true
    },
    {
      "name": "upper_arm_l",
      "parent": "clavicle_l",
      "deform": true,
      "connected": true,
      "head_m": [
        0.1850000023841858,
        0.0,
        1.4299999475479126
      ],
      "tail_m": [
        0.39359647035598755,
        0.0,
        1.2214034795761108
      ],
      "z_axis": [
        4.842877743271856e-08,
        1.0,
        4.842878098543224e-08
      ],
      "pose_identity": true
    },
    {
      "name": "forearm_l",
      "parent": "upper_arm_l",
      "deform": true,
      "connected": true,
      "head_m": [
        0.39359647035598755,
        0.0,
        1.2214034795761108
      ],
      "tail_m": [
        0.5739086866378784,
        0.0,
        1.0410912036895752
      ],
      "z_axis": [
        2.6077035641947077e-08,
        1.0,
        2.607703031287656e-08
      ],
      "pose_identity": true
    },
    {
      "name": "hand_l",
      "parent": "forearm_l",
      "deform": true,
      "connected": true,
      "head_m": [
        0.5739086866378784,
        0.0,
        1.0410912036895752
      ],
      "tail_m": [
        0.641083836555481,
        0.0,
        0.9739160537719727
      ],
      "z_axis": [
        4.842878098543224e-08,
        1.0,
        4.842878098543224e-08
      ],
      "pose_identity": true
    },
    {
      "name": "thumb_01_l",
      "parent": "hand_l",
      "deform": true,
      "connected": false,
      "head_m": [
        0.6255275011062622,
        0.0,
        1.0432125329971313
      ],
      "tail_m": [
        0.6585274934768677,
        0.0,
        1.0432125329971313
      ],
      "z_axis": [
        1.4210854715202004e-14,
        1.0,
        7.549790836947068e-08
      ],
      "pose_identity": true
    },
    {
      "name": "thumb_02_l",
      "parent": "thumb_01_l",
      "deform": true,
      "connected": true,
      "head_m": [
        0.6585274934768677,
        0.0,
        1.0432125329971313
      ],
      "tail_m": [
        0.6865274906158447,
        0.0,
        1.0432125329971313
      ],
      "z_axis": [
        8.763515527674976e-15,
        1.0,
        7.549790126404332e-08
      ],
      "pose_identity": true
    },
    {
      "name": "thumb_03_l",
      "parent": "thumb_02_l",
      "deform": true,
      "connected": true,
      "head_m": [
        0.6865274906158447,
        0.0,
        1.0432125329971313
      ],
      "tail_m": [
        0.7115274667739868,
        0.0,
        1.0432125329971313
      ],
      "z_axis": [
        8.763516374707923e-15,
        1.0,
        7.549790126404332e-08
      ],
      "pose_identity": true
    },
    {
      "name": "index_01_l",
      "parent": "hand_l",
      "deform": true,
      "connected": false,
      "head_m": [
        0.6622970104217529,
        0.0,
        0.9951292276382446
      ],
      "tail_m": [
        0.688389241695404,
        0.0,
        0.9690369963645935
      ],
      "z_axis": [
        4.842877388000488e-08,
        1.0,
        4.842878098543224e-08
      ],
      "pose_identity": true
    },
    {
      "name": "index_02_l",
      "parent": "index_01_l",
      "deform": true,
      "connected": true,
      "head_m": [
        0.688389241695404,
        0.0,
        0.9690369963645935
      ],
      "tail_m": [
        0.7069437503814697,
        0.0,
        0.9504824876785278
      ],
      "z_axis": [
        3.552713678800501e-15,
        1.0,
        -3.552713678800501e-15
      ],
      "pose_identity": true
    },
    {
      "name": "index_03_l",
      "parent": "index_02_l",
      "deform": true,
      "connected": true,
      "head_m": [
        0.7069437503814697,
        0.0,
        0.9504824876785278
      ],
      "tail_m": [
        0.7202798128128052,
        0.0,
        0.9371464252471924
      ],
      "z_axis": [
        4.842878453814592e-08,
        1.0,
        4.842878098543224e-08
      ],
      "pose_identity": true
    },
    {
      "name": "middle_01_l",
      "parent": "hand_l",
      "deform": true,
      "connected": false,
      "head_m": [
        0.6460335850715637,
        0.0,
        0.9788658022880554
      ],
      "tail_m": [
        0.6749895811080933,
        0.0,
        0.9499098062515259
      ],
      "z_axis": [
        4.842877743271856e-08,
        1.0,
        4.842877388000488e-08
      ],
      "pose_identity": true
    },
    {
      "name": "middle_02_l",
      "parent": "middle_01_l",
      "deform": true,
      "connected": true,
      "head_m": [
        0.6749895811080933,
        0.0,
        0.9499098062515259
      ],
      "tail_m": [
        0.6955805420875549,
        0.0,
        0.9293188452720642
      ],
      "z_axis": [
        3.552713678800501e-15,
        1.0,
        -3.552713678800501e-15
      ],
      "pose_identity": true
    },
    {
      "name": "middle_03_l",
      "parent": "middle_02_l",
      "deform": true,
      "connected": true,
      "head_m": [
        0.6955805420875549,
        0.0,
        0.9293188452720642
      ],
      "tail_m": [
        0.7103803157806396,
        0.0,
        0.9145190715789795
      ],
      "z_axis": [
        2.0842395514417958e-15,
        1.0,
        -2.0842395514417958e-15
      ],
      "pose_identity": true
    },
    {
      "name": "ring_01_l",
      "parent": "hand_l",
      "deform": true,
      "connected": false,
      "head_m": [
        0.6290630102157593,
        0.0,
        0.961895227432251
      ],
      "tail_m": [
        0.6554734706878662,
        0.0,
        0.935484766960144
      ],
      "z_axis": [
        4.842877743271856e-08,
        1.0,
        4.842878098543224e-08
      ],
      "pose_identity": true
    },
    {
      "name": "ring_02_l",
      "parent": "ring_01_l",
      "deform": true,
      "connected": true,
      "head_m": [
        0.6554734706878662,
        0.0,
        0.935484766960144
      ],
      "tail_m": [
        0.6742542386054993,
        0.0,
        0.916703999042511
      ],
      "z_axis": [
        3.552713678800501e-15,